,course,description,image,instructor,link,price,subject,provider,jobs,subject_id
1305,AWS MasterClass: Monitoring  and DevOps with AWS CloudWatch,AWS Master Class - Master Monitoring and Alerting Services in Amazon Cloud Using AWS CloudWatch & SNS for DevOps and Ops,https://udemy-images.udemy.com/course/125_H/1217244_e655_3.jpg,TetraTutorials Team,/aws-monitoring-alerting-with-aws-cloudwatch-and-aws-sns/,$194.99,Network & Security,Udemy,"0,3,4,6,12,22,28,38,55",33
1306,Learn The Basics of Ethical Hacking and Penetration Testing,You donÃ¢ÂÂt have to be perfect to be a hacker. Or the smartest person in the room. Or a type-A personality.,https://udemy-images.udemy.com/course/125_H/27276_e0f3_9.jpg,Mohamed Ramadan,/learn-the-basics-of-ethical-hacking-and-penetration-testing/,$199.99,Network & Security,Udemy,"0,3,4,6,12,22,28,38,55",33
1307,Business Strategy: 8 Best Strategies For Business Growth,"Business Strategy: 8 Best Strategies To Design Successful Projects, Fast Business Growth For A Massive Transformation",https://udemy-images.udemy.com/course/125_H/1254588_f3a0_3.jpg,Jean-Gabriel Paquette,/business-strategy-8-best-strategies-for-business-growth/,$184.99,Strategy,Udemy,"2,5,6,9,13,15,32,34,37,40,51,52,60,73,81",79
1308,Create Augmented Reality Apps using Vuforia in Unity,Learn from Scratch on how to Create Augmented Reality Apps using Vuforia and Unity SDK,https://udemy-images.udemy.com/course/125_H/1026356_f4f2_4.jpg,Arduino Startups,/create-augmented-reality-apps-using-vuforia-in-unity-sdk/,$189.99,Game Development,Udemy,,49
1309,The Complete iOS11 Swift4 Development Course - Build 28 Apps,Use Xcode 9 & Swift 4 to make great apps. Learn CoreML (Machine Learning) & ARKit (Artificial Reality) for iOS 11,https://udemy-images.udemy.com/course/125_H/1279322_8dcd_5.jpg,Dee Aliyu Odumosu,/the-complete-ios-11-course/,$199.99,Mobile Apps,Udemy,"2,33,47,48,57,62,80,82",31
1310,UI/UX design with Adobe XD: Design & Prototype a Mobile App,Learn how to design a beautiful and engaging mobile app with Adobe Experience Design (XD). Learn-by-doing approach.,https://udemy-images.udemy.com/course/125_H/1033446_4080_2.jpg,Luca Vavassori,/adobe-xd-course/,$39.99,User Experience,Udemy,"2,15,16,29,31,32,33,34,35,36,37,38,42,44,50,51,52,58,68,69,70,71,72,73,74,75,77,78",50
1311,Merch By Amazon: Build A Successful T-shirt Business Online,Learn How To Do T-shirt Design And Start Your Own Successful T-shirt Business With Merch By Amazon.,https://udemy-images.udemy.com/course/125_H/1452374_f33b.jpg,Masuk Sarker Batista,/merch-by-amazon-tshirt-business-masterclass/,$199.99,Home Business,Udemy,,29
1312,Logo Design in Adobe Illustrator - for Beginners & Beyond,"The entire logo design procedure & business revealed by a published, award winning professional!",https://udemy-images.udemy.com/course/125_H/595876_f52f_13.jpg,Daniel Evans,/logodesign/,$199.99,Graphic Design,Udemy,"10,16,22,23,35,58,64",58
1313,Ansible for Network Engineers: Quick Start GNS3 & Ansible,"Ansible for Network Engineers with GNS3, Ansible and Cisco IOS. Learn Network Automation & Programmability = the future",https://udemy-images.udemy.com/course/125_H/1321172_570f_4.jpg,David Bombal,/ansible-for-network-engineers-cisco-quick-start-gns3-ansible/,$39.99,Network & Security,Udemy,"0,3,4,6,12,22,28,38,55",33
1314,The Colored Pencil Drawing Course,Draw Like a Pro With Colored Pencils,https://udemy-images.udemy.com/course/125_H/381588_2e6d_4.jpg,Matthew Fussell,/the-colored-pencil-course/,$34.99,Arts & Crafts,Udemy,"10,23,25,28,35,39,49,64",77
1315,Vue JS 2.0 - Mastering Web Apps,"Create the VueJS 2.0 apps you always wanted. Build 5 apps, learn development secrets, VueRouter, Vuex, & more!",https://udemy-images.udemy.com/course/125_H/1165096_e5af_3.jpg,David Katz,/vue-web-apps/,$79.99,Web Development,Udemy,"16,18,21,27,41,47,54,56,62,65,68,69,70,82",22
1316,The NEW 2018 Complete Growth Hacking & Conversion Course,"100+ Techniques, Strategies & Walkthroughs to Increase Growth, Conversion, Leads, Clicks and Sales",https://udemy-images.udemy.com/course/125_H/649056_69f2_13.jpg,iMarket XL,/growth-hacking-conversion/,$194.99,Growth Hacking,Udemy,,82
1317,Introduction to Data Analysis using EXCEL for Beginners,Learn to apply the important concepts and techniques in data analysis using Excel.,https://udemy-images.udemy.com/course/125_H/1242944_5bcc_6.jpg,Symon He,/business-data-analysis-excel/,$194.99,Data & Analytics,Udemy,"2,3,5,6,9,11,12,13,16,24,26,27,28,29,30,31,32,33,37,43,44,45,48,53,55,56,59,61,62,63,65,70,74,75,76,78,80,81,84,85",27
1318,Linux for Beginners,An Introduction to the Linux Operating System and Command Line,https://udemy-images.udemy.com/course/125_H/149910_25f7_7.jpg,Jason Cannon,/linuxforbeginners/,$94.99,Operating Systems,Udemy,42,30
1319,JavaScript the Basics - JavaScript for Beginners,"JavaScript for Beginners: Learn JavaScript through whiteboard videos, coding in the browser and build a Website",https://udemy-images.udemy.com/course/125_H/860812_f16e_20.jpg,Rob Merrill,/javascript-the-basics-for-beginners/,$169.99,Web Development,Udemy,"16,18,21,27,41,47,54,56,62,65,68,69,70,82",22
1320,The Complete Python 3 Course: Beginner to Advanced!,"Learn Python with projects covering game & web development, web scraping, MongoDB, Django, PyQt, and data visualization!",https://udemy-images.udemy.com/course/125_H/882826_4687_3.jpg,Joseph Delgadillo,/python-complete/,$194.99,Programming Languages,Udemy,,24
1321,Create Game Assets with Blender and Substance Painter,Learn to create high quality game assets for video games,https://udemy-images.udemy.com/course/125_H/1163908_7df1.jpg,Darrin Lile,/create-game-assets-with-blender-and-substance-painter/,$39.99,3D & Animation,Udemy,"6,17,24,31",61
1322,Unleash Your Creative Mind,Improve Your Professional and Personal Life By Unleashing Your Creative Mind,https://udemy-images.udemy.com/course/125_H/1162682_dfe5_2.jpg,Susmita Dutta,/unleash-your-creative-mind-and-transform-your-world/,$199.99,Creativity,Udemy,"39,42,71,73",51
1323,How to Improve Your Figure Drawing - Step by Step,Learn how to draw the human form like a professional with these fundamental step by step techniques.,https://udemy-images.udemy.com/course/125_H/859702_a510.jpg,Robert Marzullo,/how-to-improve-your-figure-drawing-step-by-step/,$194.99,Arts & Crafts,Udemy,"10,23,25,28,35,39,49,64",77
1324,Music Theory for Electronic Producers - The Complete Course!,"Join Successful students in Music Theory for Electronic Producers for Creating, Arranging and Analysing Music Theory",https://udemy-images.udemy.com/course/125_H/1020830_a324_11.jpg,Tomas George,/electronicmusictheory/,$194.99,Music Techniques,Udemy,,104
1325,MCSA Windows Server 2012: MCSE Certification & Powershell,"MCSA Windows Server 2012 Exam 70-410, 70-412 & 70-411: MCSE Certification, Active Directory, Group Policy & Powershell",https://udemy-images.udemy.com/course/125_H/1547994_5e07_3.jpg,Easy Learn,/mcsa-windows-server-2012-mcse-certification-powershell/,$184.99,IT Certification,Udemy,,34
1326,Videoscribe Whiteboard Animations: The Complete Guide,High quality professional Sparkol Videoscribe whiteboard video animations. Videoscribe training videos for beginners,https://udemy-images.udemy.com/course/125_H/1283168_2b07_6.jpg,Life Progression Project,/videoscribe-whiteboard-animations-videoscribe-for-beginners/,$199.99,Video & Mobile Marketing,Udemy,"0,12,22,23,40,60",121
1327,Landscape Photography: You Can Take Your Own Stunning Photos,You will shoot amazing photos that impress your family and friends with this complete landscape photography course!,https://udemy-images.udemy.com/course/125_H/1171498_e380_2.jpg,Phil Ebiner,/landscape-photography-course/,$99.99,Landscape,Udemy,"6,27",110
1328,Tweetme | Build a Twitter-like app step by step with Django,"Learn Django 1.10, jQuery, and Bootstrap step by step by building a real project that works like Twitter!",https://udemy-images.udemy.com/course/125_H/1029638_267b_2.jpg,Justin Mitchel,/tweetme-django/,$194.99,Web Development,Udemy,"16,18,21,27,41,47,54,56,62,65,68,69,70,82",22
1329,How to Analyze Multifamily Investment Opportunities,Learn professional techniques and use investment grade models to evaluate and analyze multifamily investment deals,https://udemy-images.udemy.com/course/125_H/1009988_ed18_8.jpg,Symon He,/multifamily-investment-analysis/,$104.99,Real Estate,Udemy,,88
1330,REST API Testing Automation: via REST Assured,"API Automation Testing via Rest Assured Java, Automation  Testing Framework, API Testing via POSTMAN & HTTP Client",https://udemy-images.udemy.com/course/125_H/1449262_3a67_6.jpg,Automation Testing Experts,/api-testing-rest-api-automation-testing-from-scratch/,$34.99,Software Testing,Udemy,44,40
1331,Practice Tests for 70-532 Developing MS Azure Solutions,3 full practice exams that test your knowledge of 70-532 Microsoft Azure Developer exam,https://udemy-images.udemy.com/course/125_H/1277288_17e0.jpg,Scott Duffy,/70532-azure-tests/,$99.99,IT Certification,Udemy,,34
1332,Big Data and Hadoop for Beginners - with Hands-on!,"Everything you need to know about Big Data, and Learn Hadoop, HDFS, MapReduce, Hive & Pig by designing Data Pipeline.",https://udemy-images.udemy.com/course/125_H/519406_959b_6.jpg,Andalib Ansari,/big-data-and-hadoop-for-beginners/,$199.99,Data & Analytics,Udemy,"2,3,5,6,9,11,12,13,16,24,26,27,28,29,30,31,32,33,37,43,44,45,48,53,55,56,59,61,62,63,65,70,74,75,76,78,80,81,84,85",27
1333,Online Japanese Beginner Course (All 12 lessons?,[???????????????]Elementary Japanese for non-Japanese Beginner Course Hiragana + Katakana + Conversation (All 12 lesson),https://udemy-images.udemy.com/course/125_H/628588_7273_2.jpg,Attain Corp.,/online-japanese-beginner-course/,$89.99,Japanese,Udemy,,94
1334,Primal Learning - Join the Top 1% Fastest Learners,Hack the flow state. Multiply your productivity. Ace your exams. Optimize your lifestyle. Double your reading speed.,https://udemy-images.udemy.com/course/125_H/684420_0481_6.jpg,Mathias G,/primal-learning/,$199.99,Memory & Study Skills,Udemy,,28
1335,Management Consulting Project Foundations,Develop corporate strategy for a multi-million business to revive sales and streamline operations,https://udemy-images.udemy.com/course/125_H/1506414_0cdd_3.jpg,Tom Kerr,/management-consulting-project-foundations/,$184.99,Project Management,Udemy,"11,13,24,43,51,55,73",37
1336,Mastering Advanced Color Grading in Photoshop,Learn Professional Color Grading Techniques in Photoshop and make your Images Stand Out - with Ressources,https://udemy-images.udemy.com/course/125_H/1202478_3926.jpg,Marcin Mikus,/mastering-color-grading-in-photoshop/,$199.99,Digital Photography,Udemy,,92
1337,Boost Your Mac Productivity,Practical and powerful techniques to work and create more efficiently on your Mac,https://udemy-images.udemy.com/course/125_H/1466258_e9d0.jpg,Gary Rosenzweig,/mac-productivity/,$49.99,Operating Systems,Udemy,42,30
1338,Nginx Fundamentals: High Performance Servers from Scratch,Learn how to install & configure an Nginx web server from scratch.,https://udemy-images.udemy.com/course/125_H/619222_0b73_5.jpg,Ray Viljoen,/nginx-fundamentals/,$144.99,Network & Security,Udemy,"0,3,4,6,12,22,28,38,55",33
1339,Rapid Prototyping for Entrepreneurs| Build a Demo in 2 hours,"Learn how to wireframe and create realistic interactive prototypes in just 2 hours, all without using code.",https://udemy-images.udemy.com/course/125_H/444504_e953_4.jpg,Evan Kimbrell,/rapid-prototyping-for-entrepreneurs-build-a-demo-in-2-hours/,$94.99,Entrepreneurship,Udemy,,38
1340,The Non-Technical Person's guide to building products & apps,"Go from Idea to MVP with no CTO and no coding. Launch your business, app, or product idea cheaply, quickly, and easily.",https://udemy-images.udemy.com/course/125_H/369660_c351_3.jpg,Evan Kimbrell,/launch-your-idea-idea-to-mvp-with-no-cto-and-no-coding/,$194.99,Entrepreneurship,Udemy,,38
1341,Oracle PL/SQL Fundamentals vol. I & II,A complete introduction to PL/SQL database programming language,https://udemy-images.udemy.com/course/125_H/128786_83a3_10.jpg,Intellezy Trainers,/oracle-plsql-fundamentals-vol-i-ii/,$89.99,Oracle,Udemy,30,95
1342,Microsoft SQL for Beginners,A comprehensive course to teach you how to complete SQL queries using Microsoft SQL Server and the T-SQL language.,https://udemy-images.udemy.com/course/125_H/459948_7533_2.jpg,Brewster Knowlton,/microsoft-sql-for-beginners/,$44.99,Programming Languages,Udemy,,24
1343,Certificate EU GDPR General Data Protection Regulation 2018,World-Class Certificate General Data Protection Regulation(GDPR) - Data Security Protection  Compliance Author Professor,https://udemy-images.udemy.com/course/125_H/1426514_597a_2.jpg,"Prof Robert Sullivan, MA, MBA, FistlLM, FRSA",/2018-general-data-protection-regulation/,$194.99,Management,Udemy,"0,5,8,9,11,12,13,23,24,28,31,32,33,34,40,43,44,51,54,55,56,60,63,65,66,70,73,75,81",56
1344,Successful Negotiation: Master Your Negotiating Skills,Master negotiation with these negotiating tips,https://udemy-images.udemy.com/course/125_H/477888_34f6.jpg,Chris Croft,/a-practical-guide-to-negotiating/,$94.99,Influence,Udemy,"2,3,10,13,38,40,71,78",54
1345,The Art of Public Speaking - Become a Confident Presenter,Overcoming public speaking anxiety is not as hard as you may think! All you need is the right public speaking course.,https://udemy-images.udemy.com/course/125_H/1335042_7a07_2.jpg,Jimmy Naraine,/the-art-of-public-speaking-become-a-confident-presenter/,$149.99,Communications,Udemy,"10,20,23,24,38,40,46,55,60,73,81",43
1346,The Complete MacOS Developer Course - Apps for the Desktop!,"Using your iPhone development background, create Mac apps with Cocoa using the latest Swift 3 and Xcode 8 OS X",https://udemy-images.udemy.com/course/125_H/994186_795e_2.jpg,Nick Walter,/macos-programming-for-ios-developers-mac-apps-os-x-cocoa/,$199.99,Software Engineering,Udemy,"32,55",45
1347,AWS Certified Solutions Architect - Professional 2018,All you need to master AWS Solutions Architect - Professional certification,https://udemy-images.udemy.com/course/125_H/1425762_36e3.jpg,Zeal Vora,/aws-certified-solutions-architect-professional/,$34.99,IT Certification,Udemy,,34
1348,The Complete Unity 3D Game Development Course - Make 6 Games,"Create Amazing 3D Games With C#, Unity 2017 & Blender -  ZigZag, Minesweeper, Fruit Ninja, Farmville And Many More",https://udemy-images.udemy.com/course/125_H/1399296_e175.jpg,Denis Panjuta,/unity-developer-course/,$199.99,Game Development,Udemy,,49
1349,Food Photography: Capturing Food in Your Kitchen,"With DIY Food Photography, you'll be taking better photos in no time with what you have in your own kitchen!",https://udemy-images.udemy.com/course/125_H/840622_1ff1.jpg,Phil Ebiner,/food-photography/,$99.99,Digital Photography,Udemy,,92
1350,Learn Digital Painting to Make Cell Shaded Concept Art,Become a cell shading master!,https://udemy-images.udemy.com/course/125_H/886644_3421_3.jpg,Austin Batchelor,/learn-digital-painting-to-make-cell-shaded-concept-art/,$64.99,Game Design,Udemy,16,55
1351,Oracle SQL : Become a Certified SQL Developer From Scratch!,"Learn SQL with a ""Professional Certification Course"", Hundreds of Examples with True and False Usages, English Subtitle!",https://udemy-images.udemy.com/course/125_H/549998_134f_13.jpg,Oracle Master Training,/oracle-sql-12c-become-an-sql-developer-with-subtitle/,$199.99,IT Certification,Udemy,,34
1352,Mastering Thinking Skills Vol 1: The 12 Fundamental Skills,How to think differently to and solve problems at multiple levels of depth,https://udemy-images.udemy.com/course/125_H/1214140_0925_5.jpg,Timothy Kenny,/thinking-skills-m/,$199.99,Memory & Study Skills,Udemy,,28
1353,"Arts Therapy : For Greater Understanding of The ""Self""","Arts Therapy : Understanding Art Therapy - Expressing & Developing The ""Self"" Through Arts Therapy and Therapeutic Art",https://udemy-images.udemy.com/course/125_H/1363720_2b35_3.jpg,Libby Seery - Founder of Renaissance Life Therapies,/arts-therapy-for-greater-understanding-of-the-self/,$199.99,Creativity,Udemy,"39,42,71,73",51
1354,"Drawing Course: Figure Drawing, Sketching & Character Design","Drawing Course Beginner To Advanced: Figure & Cartoon Drawing, Sketching, Character Design, Art Therapy & Illustration",https://udemy-images.udemy.com/course/125_H/1503366_a337_2.jpg,Infinite Knowledge,/drawing-course-figure-drawing-sketching-character-design/,$184.99,Graphic Design,Udemy,"10,16,22,23,35,58,64",58
1355,Android App Development: Mobile App Development & Java,"Android App Development & Java Programming: Mobile App Development & Design, Build Android Apps, Android 5 & Lollipop",https://udemy-images.udemy.com/course/125_H/1512578_b4eb_2.jpg,Easy Learn,/android-app-development-mobile-app-development-java/,$184.99,Mobile Apps,Udemy,"2,33,47,48,57,62,80,82",31
1356,Advanced iOS 11: Mastering Push Notifications,Everything you could ever want to know about push notifications for iOS 11 in Swift,https://udemy-images.udemy.com/course/125_H/1377870_f445.jpg,Devslopes by Mark Price,/ios-push-notifications/,$199.99,Mobile Apps,Udemy,"2,33,47,48,57,62,80,82",31
1357,Adobe Illustrator CC Graphic Web Design: UI & Logo Design,"Adobe Illustrator CC Graphic Design: Web Design, UI Design, Logo Design, Sketch & UX Design For Designers & Developers",https://udemy-images.udemy.com/course/125_H/1495792_93af_3.jpg,Easy Learn,/adobe-illustrator-cc-graphic-web-design-ui-logo-design/,$184.99,Graphic Design,Udemy,"10,16,22,23,35,58,64",58
1358,Become a Good Matlab Programmer in less than 30 days,"This is the last time, you wish you could be a Matlab Programmer.",https://udemy-images.udemy.com/course/125_H/201594_5c9b_16.jpg,Hossein Tootoonchy,/matlab-programming-fundamentals/,$194.99,Programming Languages,Udemy,,24
1359,Running A Web Design Business,How to run a successful web design business from home Ã¢ÂÂ get recurring revenue from great clients.,https://udemy-images.udemy.com/course/125_H/65208_3c05_10.jpg,Rob Cubbon,/running-a-web-design-business/,$94.99,Web Design,Udemy,"9,16,35,41,58,68,69,80,83",44
1360,Start Your Own App Business in 2 Weeks,How to develop and market apps to companies: your hands-on guide to this rewarding and profitable career!,https://udemy-images.udemy.com/course/125_H/1243914_58f5_4.jpg,Codestars by Rob Percival,/start-your-own-app-business-in-2-weeks/,$199.99,Product Marketing,Udemy,60,122
1361,"Marketing Principles A-Z, 21 Marketing Tips & Techniques","increase sale, customers & attention by using 21 cognitive biases of marketing + customer & web design marketing A-Z",https://udemy-images.udemy.com/course/125_H/1369820_8a35_2.jpg,Alireza Etemadi,/digital-social-media-marketing-principles-tips-techniques-sale/,$184.99,Marketing Fundamentals,Udemy,,57
1362,React Redux React-Router: From Beginner to Paid Professional,"learn React, Redux, React-Router, ECMAScript2015(ES6) by creating many applications such as Todo List, YouTube and Imgur",https://udemy-images.udemy.com/course/125_H/920544_7d1f.jpg,Leonardo Daniel,/react-redux-react-router/,$19.99,Web Development,Udemy,"16,18,21,27,41,47,54,56,62,65,68,69,70,82",22
1363,Redux in Angular (2 and 4+),"Better manage the state of your Angular apps, improve their testability and use awesome debugging tools",https://udemy-images.udemy.com/course/125_H/1251786_28b0.jpg,Mosh Hamedani,/redux-in-angular/,$69.99,Web Development,Udemy,"16,18,21,27,41,47,54,56,62,65,68,69,70,82",22
1364,Intermediate Game Asset Creation - 3D Modeling in Blender,"Learn intermediate 3D modeling, texturing, and rendering with Blender and 3D-Coat by creating AAA ready game assets",https://udemy-images.udemy.com/course/125_H/1428764_91f2.jpg,Concept Courses ?????,/intermediate-game-asset-creation-3d-modeling-in-blender/,$99.99,3D & Animation,Udemy,"6,17,24,31",61
1365,"GIMP Beginner to Advanced, Learn GIMP From a Pro Designer",Learn GIMP from a pro photographer & graphic designer.  Everything you need to know in one course.  Learn GIMP by doing.,https://udemy-images.udemy.com/course/125_H/1347812_3fb6.jpg,Chris Parker,/gimp-made-easy/,$44.99,Design Tools,Udemy,"34,36,58,67,80",67
1366,MuseScore: Mastering Music Notation Free Software,"Learn to use the powerful free program MuseScore for composition, theory, film scoring, guitar tablature, and more.",https://udemy-images.udemy.com/course/125_H/1488260_3e0f.jpg,Jason Allen,/musescore-mastering-music-notation-free-software/,$19.99,Music Software,Udemy,,81
1367,Learning Dynamic Website Design - PHP MySQL and JavaScript,"Learn Dynamic Web Design with PHP / MySQL, AJAX, JavaScript and CSS. Course comes with Certificate of Completion. ",https://udemy-images.udemy.com/course/125_H/19603_713c_6.jpg,Infinite Skills,/learning-dynamic-website-design/,$49.99,Web Development,Udemy,"16,18,21,27,41,47,54,56,62,65,68,69,70,82",22
1368,"Master MongoDB, the NOSQL leader with Clarity and Confidence",Learn MongoDB - Updated Every Week 100+interview Questions 100+Quizzes 60+Assignments  mongobooster  java C# nodejs php,https://udemy-images.udemy.com/course/125_H/1136646_d67b_4.jpg,Gandhi Kumarasamy Sezhian,/learn-mongodb-the-nosql-leader-with-clarity-and-confidence/,$154.99,Databases,Udemy,"26,27,30,44,45,48,55",39
1369,Hypnosis - Hypnotic Inductions Mastery,Master the Hypnotic Process - Learn all styles of Inductions; Understand Hypnosis Theory; Artfully use Hypnotic Language,https://udemy-images.udemy.com/course/125_H/1451156_e300_3.jpg,Steven Burns,/hypnosis-hypnotic-inductions-mastery/,$199.99,Personal Transformation,Udemy,,25
1370,Practical Hacking 2018: Undetectable Malware,Become A Real HACKER! : Learn How bypass all the Antiviruses and Firewall Also Learn the Defense of it.,https://udemy-images.udemy.com/course/125_H/1541392_ad33_3.jpg,Arsalan Saleem,/metasploit-offensive-security-methods/,$24.99,Network & Security,Udemy,"0,3,4,6,12,22,28,38,55",33
1371,Business Bootcamp: 7 Weeks to Start Your Own Business,Launch your own business doing what you love. This step-by-step business guide will get you started in just 7 weeks.,https://udemy-images.udemy.com/course/125_H/792598_132f_5.jpg,Phil Ebiner,/business-bootcamp/,$199.99,Entrepreneurship,Udemy,,38
1372,Java Web Services & Java EE Microservices: JSP Servlets JBDC,"Java RESTFUL Web Services & Java EE Microservices: JSP and Servlets, JBDC, JBoss, AJAX, JAX-RS, JAX-WS, JavaServer Faces",https://udemy-images.udemy.com/course/125_H/1524532_0b55_3.jpg,Infinite Knowledge,/java-web-services-java-ee-microservices-jsp-servlets-jbdc/,$184.99,Web Development,Udemy,"16,18,21,27,41,47,54,56,62,65,68,69,70,82",22
1373,ITIL v3 Foundations: Cram to Pass the ITIL Exam in 7 Days!,"A time-compressed resource to passing ITIL v3 Foundations exam on the 1st attempt, includes 2 realistic practice exams!",https://udemy-images.udemy.com/course/125_H/1253974_401b_5.jpg,Jason Dion,/itilv3-foundations-cram/,$199.99,IT Certification,Udemy,,34
1374,SAP ABAP Programming For Beginners - Online Training,Learn SAP ABAP Programming With Peter Moxon. Help Study For Certification - Life Time Access + Updates!,https://udemy-images.udemy.com/course/125_H/20365_92cc_7.jpg,Peter Moxon,/sap-abap-programming-for-beginners/,$94.99,SAP,Udemy,"11,19,54,79",120
1375,The Complete Ethereum Course: Get .001 Ether In Your Wallet,"Get involved with Ethereum on this course! It is the most talked about, and valuable cryptocurrency since Bitcoin.",https://udemy-images.udemy.com/course/125_H/859742_e075_14.jpg,Ravinder Deol,/ethereum/,$99.99,Finance,Udemy,"56,60,65",32
1376,Build a Crypto Currency Portfolio App With Python,Let's Build A Cool App With Python 3!,https://udemy-images.udemy.com/course/125_H/1535972_6aef_2.jpg,John Elder,/build-a-crypto-currency-portfolio-app-with-python/,$199.99,Programming Languages,Udemy,,24
1377,How to Generate Passive Income With No Initial Funds,Generate a Passive Income stream that pays you dividends for the months and years to come,https://udemy-images.udemy.com/course/125_H/1272578_85df.jpg,Bryan Guerra,/how-to-generate-passive-income-with-no-initial-funds/,$199.99,Digital Marketing,Udemy,"12,13,60,73,80",48
1378,Increase Your Intuitive Abilities Using EFT (Tapping),"Use Emotional Freedom Technique (EFT) to open your intuitive channels: clair-audience, clair-voyance & clair-sentience.",https://udemy-images.udemy.com/course/125_H/580526_470a.jpg,Cha~zay Sandhriel Ph.D.,/eft-tapping/,$119.99,Personal Transformation,Udemy,,25
1379,Projects In ReactJS - The Complete React Learning Course,Learn React Building  Ten Real World Projects,https://udemy-images.udemy.com/course/125_H/1016388_25d0_2.jpg,Eduonix Learning Solutions,/projects-in-reactjs-the-complete-react-learning-course/,$49.99,Web Development,Udemy,"16,18,21,27,41,47,54,56,62,65,68,69,70,82",22
1380,Learn JMETER from Scratch -(Performance + Load) Testing,Top class Jmeter lectures explaining Load testing with real time examples including material and query support,https://udemy-images.udemy.com/course/125_H/380872_c6cc_5.jpg,Rahul Shetty,/learn-jmeter-from-scratch-performance-load-testing-tool/,$149.99,Software Testing,Udemy,44,40
1381,Excel with The Ultimate Microsoft Excel Course,"Go from Excel Beginner to Excel Expert in 10 Hours - Using Microsoft Excel 2010, Excel 2013 or Excel 2016",https://udemy-images.udemy.com/course/125_H/787396_c549_3.jpg,Steve McDonald,/excel-with-the-ultimate-microsoft-excel-course/,$189.99,Microsoft,Udemy,"11,23,30,63,73,79",36
1382,Digital Painting Master Class : Beginner to Advanced,"Digital drawing and painting has never been this fun.  Illustrate characters, creatures, landscapes and more!",https://udemy-images.udemy.com/course/125_H/1364986_ef06_2.jpg,School of Game Design .,/adobe-photoshop-illustrator-digital-painting-master-class/,$109.99,Graphic Design,Udemy,"10,16,22,23,35,58,64",58
