,course,description,image,instructor,link,price,subject,provider,jobs,subject_id
612,Learn Microsoft Excel 2010 Advanced Course,Learn advanced Excel 2010 features and get ready to take your Excel knowledge to the next level.,https://udemy-images.udemy.com/course/125_H/29647_8b7e_3.jpg,Simon Sez IT,/learn-microsoft-excel-2010-advanced-training/,$74.99,Microsoft,Udemy,"11,23,30,63,73,79",36
613,"Sounds True's Freedom to Choose Something Different, Part 2",Pema Chodron on How to Transform Your Life and Find Lasting Peace and Happiness,https://udemy-images.udemy.com/course/125_H/796126_8f17_2.jpg,Pema ChÃ¶drÃ¶n,/freedom-to-choose-something-different-by-pema-chodron-pt-2/,$199.99,Personal Transformation,Udemy,,25
614,Become AWS Certified - Solutions Architect Associate (CSA),"Everything You Need to Pass your AWS Solutions Architect - Associate Exam. Lectures, Demos, and Lab Manual & More!",https://udemy-images.udemy.com/course/125_H/1461592_4f94_5.jpg,Codestars by Rob Percival,/awscsarch/,$199.99,IT Certification,Udemy,,34
615,How to Create an Empire on Airbnb without Owning a Home,Learn the exact strategies and techniques we use to Build an Empire on Airbnb without a Single Home,https://udemy-images.udemy.com/course/125_H/982844_47a2.jpg,David Vu,/how-to-create-an-empire-on-airbnb-without-owning-a-home/,$194.99,Home Business,Udemy,,29
616,Become a Blockchain Developer with Ethereum and Solidity,Develop your first decentralized application from scratch on the Ethereum blockchain,https://udemy-images.udemy.com/course/125_H/1194906_f5e2_5.jpg,Sebastien Arbogast,/getting-started-with-ethereum-solidity-development/,$194.99,Software Engineering,Udemy,"32,55",45
617,Lead Generation Machine: Cold Email B2B Sales Master Course,"Schedule meetings emailing small to large companies for business development, B2B, startup, consultants, & entrepreneurs",https://udemy-images.udemy.com/course/125_H/1393266_e5de.jpg,Patrick Dang,/lead-generation-machine-the-cold-emailing-master-course/,$194.99,Sales,Udemy,"0,5,6,7,12,22,23,24,26,29,30,34,36,45,61,67",78
618,The Complete Sass & SCSS Course: From Beginner to Advanced,No more cluttered CSS! Realize clean designs lightning-fast and without frustration using Sass & SCSS.,https://udemy-images.udemy.com/course/125_H/746014_ffa0_2.jpg,Joe Parys,/sasscourse/,$199.99,Web Development,Udemy,"16,18,21,27,41,47,54,56,62,65,68,69,70,82",22
619,Modern Deep Learning in Python,"Build with modern libraries like Tensorflow, Theano, Keras, PyTorch, CNTK, MXNet. Train faster with GPU on AWS.",https://udemy-images.udemy.com/course/125_H/772462_d385.jpg,Lazy Programmer Inc.,/data-science-deep-learning-in-theano-tensorflow/,$179.99,Data & Analytics,Udemy,"2,3,5,6,9,11,12,13,16,24,26,27,28,29,30,31,32,33,37,43,44,45,48,53,55,56,59,61,62,63,65,70,74,75,76,78,80,81,84,85",27
620,R Programming for Statistics and Data Science,R Programming for Data Science & Data Analysis. Applying R for Statistics and Data Visualization with GGplot2 in R,https://udemy-images.udemy.com/course/125_H/1562640_6c9c_2.jpg,365 Careers,/r-programming-for-statistics-and-data-science/,$194.99,Programming Languages,Udemy,,24
621,Creating 3D environments in Blender,"This course helps you creating wonderful environment scenes, organizing your workflow, and find the right inspiration.",https://udemy-images.udemy.com/course/125_H/683198_ef78_5.jpg,Rob Tuytel,/blender-environments/,$124.99,3D & Animation,Udemy,"6,17,24,31",61
622,Complete Guitar System - Beginner to Advanced,All-in-one Guitar Course With a Proven Step-by-step Learning System.,https://udemy-images.udemy.com/course/125_H/42271_886a_7.jpg,Erich Andreas,/complete-guitar-system-beginner-to-advanced/,$144.99,Instruments,Udemy,,74
623,The Complete Android Oreo Developer Course - Build 23 Apps!,"Learn App Development using Java & Kotlin by building real apps including Super Mario Run, Whatsapp and Instagram!",https://udemy-images.udemy.com/course/125_H/1405812_931d_2.jpg,Rob Percival,/the-complete-android-oreo-developer-course/,$199.99,Mobile Apps,Udemy,"2,33,47,48,57,62,80,82",31
624,Learn DevOps: Infrastructure Automation With Terraform,"Learn how to automate your infrastructure with terraform. Covers Terraform with AWS, Packer, Docker, ECR, ECS, Jenkins",https://udemy-images.udemy.com/course/125_H/977360_8585_4.jpg,Edward Viaene,/learn-devops-infrastructure-automation-with-terraform/,$39.99,Development Tools,Udemy,66,41
625,Create Your First RPG And FPS Multiplayer Game In Unity,Learn To Code In C# And How To Create Role Playing And First Person Shooter Multiplayer Games In Unity3D,https://udemy-images.udemy.com/course/125_H/1283930_afc4_3.jpg,Awesome Tuts,/create-your-first-rpg-and-fps-multiplayer-game-in-unity/,$194.99,Game Development,Udemy,,49
626,Black Algo Trading: Build Your Trading Robot,Trading Robots: The Comprehensive Course That Turns Beginners Into Skilled Algorithmic Traders (Learn MQL4 Algo Trading),https://udemy-images.udemy.com/course/125_H/301442_e997_6.jpg,Lucas Liew,/build-your-trading-robot/,$199.99,Finance,Udemy,"56,60,65",32
627,70-533 Implementing Microsoft Azure Infrastructure Solutions,Prove your Azure operations and implementation skills to the world.,https://udemy-images.udemy.com/course/125_H/802576_ef22.jpg,Scott Duffy,/70533-azure/,$149.99,IT Certification,Udemy,,34
628,Microsoft Windows Server 2016 Training for Beginners,"Install Windows Server 2016, Build a Windows Domain, Domain Controller, Learn DHCP, Install Windows 10, and much more...",https://udemy-images.udemy.com/course/125_H/972974_ee7f_2.jpg,Paul Hill,/windows-server-2016/,$194.99,Operating Systems,Udemy,42,30
629,Learn Ionic 3 From Scratch,"Create Cross Platform Mobile Applications with Ionic 3, Angular 4, TypeScript and Firebase.",https://udemy-images.udemy.com/course/125_H/1168848_64db_4.jpg,Paul Halliday (BSc Hons),/learn-ionic-3-from-scratch/,$179.99,Mobile Apps,Udemy,"2,33,47,48,57,62,80,82",31
630,Android Kotlin Development Masterclass using Android Oreo,Kotlin will overtake Java for Android app development.  Improve career options with Android Studio. Create your own app,https://udemy-images.udemy.com/course/125_H/1424326_2ee2_2.jpg,Tim Buchalka,/android-oreo-kotlin-app-masterclass/,$199.99,Mobile Apps,Udemy,"2,33,47,48,57,62,80,82",31
631,2018 Blog Blueprint: How To Turn Blogging Into A Career,The A-Z Guide That Will Hold Your Hand To Making A Career Through Blogging And Building A Successful Online Business,https://udemy-images.udemy.com/course/125_H/715716_6fc9_4.jpg,Mr Daniel Boehm,/100k-blog-blueprint/,$194.99,Entrepreneurship,Udemy,,38
632,The Java Spring Tutorial: Learn Java's Popular Web Framework,"Learn the hottest, most in-demand Java web framework, including web programming with Spring MVC and Hibernate. Lifetime access with no subscription on Udemy.",https://udemy-images.udemy.com/course/125_H/65830_9629_3.jpg,John Purcell,/javaspring/,$34.99,Programming Languages,Udemy,,24
633,The Complete Xamarin Developer Course:  iOS And Android!,"Build Cross Platform Android and iOS apps with Xamarin Forms, Xamarin Classic, Azure Mobile App Services, Rest and more",https://udemy-images.udemy.com/course/125_H/1419490_f988.jpg,Tim Buchalka's Learn Programming Academy,/complete-xamarin-developer-course-ios-and-android/,$199.99,Mobile Apps,Udemy,"2,33,47,48,57,62,80,82",31
634,C Programming For Beginners - Master the C Language,C Programming will increase career options.  Become a better dev in other languages by learning C.   Pointers explained,https://udemy-images.udemy.com/course/125_H/1467808_f8c0.jpg,Tim Buchalka's Learn Programming Academy,/c-programming-for-beginners-/,$199.99,Programming Languages,Udemy,,24
635,CompTIA CySA+ (CS0-001): Complete Course and Practice Exam,"Pass the CompTIA Cybersecurity Analyst+ (CS0-001) exam on your 1st attempt, includes CySA+ (CSA+) practice exam!",https://udemy-images.udemy.com/course/125_H/1456464_75a9_2.jpg,Jason Dion,/comptiacsaplus/,$199.99,IT Certification,Udemy,,34
636,Become a Game Designer the Complete Series Coding to Design,"Learn Unity, 3D game design, 2D game design, coding, C#, game development, 3D animation, game programming, Unity3D",https://udemy-images.udemy.com/course/125_H/526534_04bb_4.jpg,School of Game Design .,/become-a-game-designer/,$199.99,Game Design,Udemy,16,55
637,ADVANCED Swing Trading Strategy -Forex Trading/Stock Trading,A Complete - Profitable Forex Trading & Stock Trading Strategy. Master the Swings of the Trends & Earn Consistent Profit,https://udemy-images.udemy.com/course/125_H/1400902_eb12_6.jpg,Syed Rahman,/advanced-swing-trading-strategy-master-of-all-strategies/,$199.99,Strategy,Udemy,"2,5,6,9,13,15,32,34,37,40,51,52,60,73,81",79
638,Practical Data Structures & Algorithms in Java + HW,Keep it Practical! Learn in-depth the most popular Data structures & Searching Algorithms,https://udemy-images.udemy.com/course/125_H/798580_82ce_3.jpg,Imtiaz Ahmad,/practical-data-structures-algorithms-in-java/,$149.99,Programming Languages,Udemy,,24
639,Start Using Wireshark to Hack like a Pro,"Start your first capture, use Wireshark features to understand the data and analyze the network communication",https://udemy-images.udemy.com/course/125_H/929844_b4ab.jpg,Kevin Cardwell,/start-using-wireshark-to-hack-like-a-pro/,$39.99,Network & Security,Udemy,"0,3,4,6,12,22,28,38,55",33
640,Double Your Confidence & Self Esteem - Complete Blueprint,Confidence. Self Esteem. Social Skills. Social Success. Social & Inner Confidence. Body Language. Charisma. Influence.,https://udemy-images.udemy.com/course/125_H/103738_61ad_7.jpg,Jimmy Naraine,/double-your-confidence-self-esteem/,$149.99,Self Esteem,Udemy,,80
641,Dissecting Ruby on Rails 5 - Become a Professional Developer,"Don't simply follow a tutorial, learn what it really takes to become a pro Rails developer with this immersive course.",https://udemy-images.udemy.com/course/125_H/1052118_d5a9.jpg,Jordan Hudgens,/professional-rails-5-development-course/,$194.99,Web Development,Udemy,"16,18,21,27,41,47,54,56,62,65,68,69,70,82",22
642,Writing With Impact: Writing That Persuades,A University of Cambridge writing tutor takes you from complete business writing beginner to a copywriting pro!,https://udemy-images.udemy.com/course/125_H/335610_c058_4.jpg,Clare Lynch,/writing-for-business/,$199.99,Communications,Udemy,"10,20,23,24,38,40,46,55,60,73,81",43
643,The Complete Machine Learning Course with Python,"Build a Portfolio of 12 Machine Learning Projects with Python, SVM, Regression, Unsupervised Machine Learning & More!",https://udemy-images.udemy.com/course/125_H/1382702_a351.jpg,Codestars by Rob Percival,/machine-learning-course-with-python/,$199.99,Data & Analytics,Udemy,"2,3,5,6,9,11,12,13,16,24,26,27,28,29,30,31,32,33,37,43,44,45,48,53,55,56,59,61,62,63,65,70,74,75,76,78,80,81,84,85",27
644,How I Hit #1 on Google: The 2018 Complete SEO Course,"Secrets to Improve Search Position, Conversions, Traffic, Sales, Page Speed, Content, Shares & Links",https://udemy-images.udemy.com/course/125_H/329970_b7e1_11.jpg,iMarket XL,/seo-ultimate-guide/,$194.99,Search Engine Optimization,Udemy,,73
645,The Professional Guitar Masterclass,Learn The Tools Used By The World's Top Professional Guitar Players.,https://udemy-images.udemy.com/course/125_H/456284_80ce_9.jpg,Michael Palmisano,/the-professional-guitar-masterclass/,$199.99,Instruments,Udemy,,74
646,The Complete Networking Fundamentals Course. Your CCNA start,Learn about networking and start your journey to CCNA,https://udemy-images.udemy.com/course/125_H/751094_fb27_2.jpg,David Bombal,/complete-networking-fundamentals-course-ccna-start/,$19.99,Network & Security,Udemy,"0,3,4,6,12,22,28,38,55",33
647,"Beginner API development in Node, Express, ES6, & MongoDB",REST API backend development. Build Node API and restful express API,https://udemy-images.udemy.com/course/125_H/1009254_711d_2.jpg,Mark Price,/api-development/,$164.99,Web Development,Udemy,"16,18,21,27,41,47,54,56,62,65,68,69,70,82",22
648,Kotlin for Android: Beginner to Advanced,"Kotlin is an expressive, concise & powerful development language on Android. Learn everything you need to know to start",https://udemy-images.udemy.com/course/125_H/1323462_db04_2.jpg,Devslopes by Mark Price,/devslopes-android-kotlin/,$199.99,Mobile Apps,Udemy,"2,33,47,48,57,62,80,82",31
649,Selenium WebDriver with Java & Cucumber BDD,Build a start to finish web automation testing framework and simulate user behavior on a web application + LIVE TEST APP,https://udemy-images.udemy.com/course/125_H/1343662_39c4_6.jpg,Tim Short,/automate-tests-using-selenium-webdriver-with-java-cucumber/,$149.99,Software Testing,Udemy,44,40
650,Microsoft Excel - From Beginner to Expert in 6 Hours,This Microsoft Excel class will make you a master of Microsoft Excel. The training uses Excel 2013 for Windows.,https://udemy-images.udemy.com/course/125_H/49250_a658_8.jpg,Todd McLeod,/thebestexcel/,$24.99,Microsoft,Udemy,"11,23,30,63,73,79",36
651,The Complete Android Kotlin Developer Course,"Learn how to make online games, and apps for Android O, like PokÃÂ©mon , twitter,Tic Tac Toe, and notepad using Kotlin",https://udemy-images.udemy.com/course/125_H/1207960_a8af_2.jpg,Hussein Al Rubaye,/the-complete-kotlin-developer-course/,$199.99,Mobile Apps,Udemy,"2,33,47,48,57,62,80,82",31
652,Microsoft Project 2016: BEGINNER to EXPERT 10 Projects 9 PDU,Learn MS Project 2016 HANDS-ON & FAST with COMPLETE real life examples. BONUS 125 project files FREE PMI approved 9 PDUs,https://udemy-images.udemy.com/course/125_H/831116_92e7_2.jpg,Srikanth Shirodkar,/microsoft-project-tutorial/,$199.99,Microsoft,Udemy,"11,23,30,63,73,79",36
653,Learn Microsoft PowerPoint 2013 the Easy Way - 9 Hours,Master Your Presentation! Get 9-hour of PowerPoint training and learn how to use PowerPoint 2013 effectively,https://udemy-images.udemy.com/course/125_H/39952_a8f5_3.jpg,Simon Sez IT,/learn-microsoft-powerpoint-2013-training/,$74.99,Microsoft,Udemy,"11,23,30,63,73,79",36
654,Microservices with Spring Cloud,"A deep-dive into the Microservice architectural style, and how to implement it with Spring technologies.",https://udemy-images.udemy.com/course/125_H/496050_6db3_2.jpg,Ken Krueger,/microservices-with-spring-cloud/,$34.99,Software Engineering,Udemy,"32,55",45
655,Master Microsoft Excel Macros and Excel VBA,Project Based Course on Excel VBA (Visual Basic for Applications) and Excel Macros,https://udemy-images.udemy.com/course/125_H/690066_6b76_4.jpg,Kyle Pew,/master-microsoft-excel-macros-and-vba-with-5-simple-projects/,$49.99,Microsoft,Udemy,"11,23,30,63,73,79",36
656,AWS Certified Solutions Architect - Associate - Mastery 2018,The TRUE Zero-to-Hero & All-In-One Exam Preparation Guide for Amazon - AWS Certified Solutions Architect - Associate,https://udemy-images.udemy.com/course/125_H/1168192_b946_5.jpg,DolfinEd - Learning Simplified! Eissa A Sherif,/aws-certified-solutions-architect-associate-exam/,$59.99,IT Certification,Udemy,,34
657,Docker Swarm Mastery: DevOps Style Cluster Orchestration,"Build, automate, and monitor a server cluster for containers using the latest open source on Linux and Windows",https://udemy-images.udemy.com/course/125_H/1362988_fca5.jpg,Bret Fisher,/docker-swarm-mastery/,$199.99,Development Tools,Udemy,66,41
658,Learn JIRA with real-world examples (+Confluence bonus),"Learn to work on, manage & administer agile projects with this comprehensive course on JIRA Software & Confluence",https://udemy-images.udemy.com/course/125_H/1120038_2d02_5.jpg,Kosh Sarkar,/the-complete-guide-to-jira-with-real-world-examples/,$49.99,Development Tools,Udemy,66,41
659,The Board Game Developer - Become A Game Design Ninja,"Learn the principles of game design by developing board games, paper prototyping video games and more.",https://udemy-images.udemy.com/course/125_H/1256744_8682_4.jpg,Yann Burrett,/boardgames/,$99.99,Game Development,Udemy,,49
660,The Complete Presentation and Public Speaking/Speech Course,From page to stage; learn everything you need to know about giving a great speech for business & personal presentations.,https://udemy-images.udemy.com/course/125_H/1098006_6917_3.jpg,Chris Haroun,/the-complete-presentation-and-public-speaking-speech-course/,$199.99,Communications,Udemy,"10,20,23,24,38,40,46,55,60,73,81",43
661,The Basics of Blockchain,A Beginner's Guide to Blockchain,https://udemy-images.udemy.com/course/125_H/953294_3359_2.jpg,Tom Serres,/the-basics-of-blockchain/,$34.99,Other,Udemy,"1,2,6,7,9,10,11,14,17,19,20,22,23,24,25,26,27,28,29,30,32,33,34,35,37,38,40,41,42,43,45,46,47,48,50,51,53,54,55,56,57,58,60,61,65,67,68,69,70,71,72,73,74,75,78,79,80",23
662,GCP: Complete Google Data Engineer and Cloud Architect Guide,"The Google Cloud for ML with TensorFlow, Big Data with Managed Hadoop",https://udemy-images.udemy.com/course/125_H/1299656_ad0c.jpg,Loony Corn,/gcp-data-engineer-and-cloud-architect/,$99.99,Software Testing,Udemy,44,40
663,Bash Scripting and Shell Programming (Linux Command Line),"Learn bash programming for Linux, Unix, & Mac. Learn how to write bash scripts like a pro & solve real-world problems!",https://udemy-images.udemy.com/course/125_H/958532_478a_4.jpg,Jason Cannon,/bash-scripting/,$199.99,Programming Languages,Udemy,,24
664,Finding Your Life's Purpose by Eckhart Tolle,A session with Eckhart Tolle to free you from the trap of compulsive thinking.,https://udemy-images.udemy.com/course/125_H/556814_93a0_5.jpg,Eckhart Tolle,/finding-your-lifes-purpose-by-eckhart-tolle/,$79.99,Personal Transformation,Udemy,,25
665,"Ultimate Ableton Live 9 COMPLETE: Parts 1, 2, & 3","Learning Ableton Live the right way: From the basics to the advanced, from Ableton Certified Trainer J. Anthony Allen.",https://udemy-images.udemy.com/course/125_H/890884_814e.jpg,Jason Allen,/ultimate-ableton-live-complete/,$99.99,Music Software,Udemy,,81
666,[2018] Growth Hacking with Digital Marketing (version 5.2),"The world's BESTSELLING growth hacking course! Become a modern digital marketing leader. Over 30,000 alumni worldwide!",https://udemy-images.udemy.com/course/125_H/496924_8ed7_16.jpg,"Davis Jones, MBA",/growth-hacking-masterclass-become-a-digital-marketing-ninja/,$194.99,Growth Hacking,Udemy,,82
667,Become a Great Singer: Your Complete Vocal Training System,"For Serious Vocalists. Immediately Improve Your Singing. (Any Level, Any Style)",https://udemy-images.udemy.com/course/125_H/1250174_48d9_7.jpg,Robert Lunte,/become-a-great-singer-your-complete-vocal-training-system/,$199.99,Vocal,Udemy,,83
668,Android N: From Beginner to Paid Professional,Comprehensive Android Nougat app development,https://udemy-images.udemy.com/course/125_H/705934_83b6.jpg,Mark Price,/learn-android/,$199.99,Mobile Apps,Udemy,"2,33,47,48,57,62,80,82",31
669,Oracle Java Certification - Pass the Associate 1Z0-808 Exam!,This course helps you learn the steps to becoming an Oracle Certified Associate (OCA) and get that higher paying job!,https://udemy-images.udemy.com/course/125_H/1326802_8935_3.jpg,Tim Buchalka's Learn Programming Academy,/oracle-java-associate-certification-exam-course-1z0-808/,$194.99,Programming Languages,Udemy,,24
670,Build a Dropshipping Empire From Scratch. Proven Blueprint,Turn a Few Dollars into Financial Freedom Using a Proven Step-by-Step System to Create Your Own Drop Shipping Empire,https://udemy-images.udemy.com/course/125_H/661030_70d3_5.jpg,Theo McArthur,/dropship-your-way-to-2000-per-week-the-complete-blueprint/,$149.99,Home Business,Udemy,,29
671,IT Security and Ethical Hacking,"Learn the basics of IT Security, Ethical Hacking and its various concepts. Work on becoming a Certified Ethical Hacker!",https://udemy-images.udemy.com/course/125_H/432514_d638_3.jpg,LearnSmart LLC,/it-security-and-ethical-hacking/,$199.99,Network & Security,Udemy,"0,3,4,6,12,22,28,38,55",33
672,"Awaken Your Heart, Creativity & Wisdom with Tara Brach",Inhabit your full aliveness with embodied awareness,https://udemy-images.udemy.com/course/125_H/942320_580b.jpg,"Tara Brach, Ph.D.",/awaken-your-heart-creativity-wisdom-with-tara-brach/,$144.99,Personal Transformation,Udemy,,25
673,Tableau Expert: Top Visualization Techniques in Tableau 10,"Become An Expert In Tableau 10 - Master Visualisation Techniques Including Sankey Diagrams, Viola Charts And More",https://udemy-images.udemy.com/course/125_H/1323630_e250.jpg,Ben Young,/mastering-top-visualization-techniques-in-tableau/,$199.99,Data & Analytics,Udemy,"2,3,5,6,9,11,12,13,16,24,26,27,28,29,30,31,32,33,37,43,44,45,48,53,55,56,59,61,62,63,65,70,74,75,76,78,80,81,84,85",27
674,Meditation and the Evolution of Consciousness with Daaji,"Guided heartfulness meditation for beginners |Learn to meditate for happiness, improved well being and reducing stress",https://udemy-images.udemy.com/course/125_H/1217180_e6e2_3.jpg,Kamlesh D. Patel,/the-evolution-of-consciousness-heartfulness-meditation/,$19.99,Personal Transformation,Udemy,,25
675,Kotlin for Java Developers,"Use your Java skills to learn Kotlin fast. Enhance career prospects and master Kotlin, including Java interoperability",https://udemy-images.udemy.com/course/125_H/1322796_9675.jpg,Tim Buchalka's Learn Programming Academy,/kotlin-for-java-developers/,$194.99,Programming Languages,Udemy,,24
676,Tech ExplorationsÂ Arduino Step by Step Your complete guide,The original comprehensive course designed for new and intermediate-level Arduino Makers,https://udemy-images.udemy.com/course/125_H/79846_2454_11.jpg,Dr. Peter Dalmaris,/arduino-sbs/,$199.99,Hardware,Udemy,"28,30,34,38,58,62,66,81",84
677,Taming Big Data with Spark Streaming and Scala - Hands On!,Learn to process massive streams of data in real time on a cluster with Apache Spark Streaming.,https://udemy-images.udemy.com/course/125_H/831458_009d_4.jpg,Sundog Education by Frank Kane,/taming-big-data-with-spark-streaming-hands-on/,$99.99,Data & Analytics,Udemy,"2,3,5,6,9,11,12,13,16,24,26,27,28,29,30,31,32,33,37,43,44,45,48,53,55,56,59,61,62,63,65,70,74,75,76,78,80,81,84,85",27
678,"Music Theory Comprehensive Combined: Part 7, 8, & 9",Master College-Level Music Theory,https://udemy-images.udemy.com/course/125_H/1327254_6aa1.jpg,Jason Allen,/music-theory-comprehensive-combined-part-7-8-9/,$114.99,Music Fundamentals,Udemy,,59
679,Docker for the Absolute Beginner - Hands On,Learn Docker with Hands On Coding Exercises,https://udemy-images.udemy.com/course/125_H/1332278_4ea6_2.jpg,Mumshad Mannambeth,/learn-docker/,$64.99,Other,Udemy,"1,2,6,7,9,10,11,14,17,19,20,22,23,24,25,26,27,28,29,30,32,33,34,35,37,38,40,41,42,43,45,46,47,48,50,51,53,54,55,56,57,58,60,61,65,67,68,69,70,71,72,73,74,75,78,79,80",23
680,Guitar Super System Level 1,"Learn concepts extracted directly from Berklee College of Music, presented in an interactive, effective, and fun way!",https://udemy-images.udemy.com/course/125_H/484670_7b3d.jpg,Tyler Larson,/guitar-super-system-level-1-unlock-your-potential/,$49.99,Instruments,Udemy,,74
681,Growl Class - A Workshop Demo for Reactive Dogs,Dr. Ian Dunbar demonstrates how to use a group class setting to deal with dogs that are aggressive towards other dogs,https://udemy-images.udemy.com/course/125_H/356500_a78e_4.jpg,Ian Dunbar,/dunbar-growl-class/,$99.99,Pet Care & Training,Udemy,,85
682,English Grammar Launch: Upgrade your speaking and listening,"Learn English grammar through lectures and listening and speaking practice, so you can confidently speak English.",https://udemy-images.udemy.com/course/125_H/1008166_b09b.jpg,Anthony Kelleher,/learn-english-grammar-upgrade-your-speaking-and-listening/,$39.99,English,Udemy,"1,14,17,19,26,28,39,40,45",86
683,Cinematography Course: Shoot Better Video with Any Camera,Shoot better video by learning the video production techniques used by Hollywood filmmakers. And get paid to do it!,https://udemy-images.udemy.com/course/125_H/640808_ca84.jpg,Phil Ebiner,/online-cinematography-course-filmmaking-video-production-lighting/,$199.99,Video Design,Udemy,,52
684,How to DRAFT a Business Plan?,Simple method to draft a plan in less than 2 hours.,https://udemy-images.udemy.com/course/125_H/56820_10f2_9.jpg,Timmermans Laurent,/how-to-draft-a-business-plan/,$19.99,Strategy,Udemy,"2,5,6,9,13,15,32,34,37,40,51,52,60,73,81",79
685,Cryptocurrency Trading: Complete Guide To Trading Altcoins,"Cryptocurrency Trading Course From A Traders Perspective. Packed With Strategies, Examples, ICO Walkthroughs & More!",https://udemy-images.udemy.com/course/125_H/1247394_58d6.jpg,Ravinder Deol,/cryptocurrency-trading/,$99.99,Finance,Udemy,"56,60,65",32
686,The Complete Ethical Hacking Course for 2016/2017!,Gain the knowledge hackers use to compromise systems and use it to protect your own!,https://udemy-images.udemy.com/course/125_H/931384_3a37_2.jpg,Ermin Kreponic,/hacking-complete/,$194.99,Network & Security,Udemy,"0,3,4,6,12,22,28,38,55",33
687,The Complete Facebook Marketing Masterclass,"Dominate Facebook & Instagram, Take Your Business to the Next Level. Start Using the Complete Facebook Marketing Today!",https://udemy-images.udemy.com/course/125_H/1012424_6a70.jpg,Diego Davila,/facebookmarketingsystem/,$194.99,Social Media Marketing,Udemy,"17,60",47
688,The Complete Facebook Sales Funnel Blueprint,Stop Wasteful Spending on Facebook Ads That Are Not Working. Use the Facebook Sales Funnel to Skyrocket Your Sales!,https://udemy-images.udemy.com/course/125_H/1151620_07ef_11.jpg,Diego Davila,/facebooksales/,$194.99,Social Media Marketing,Udemy,"17,60",47
689,Game Music Composition: Make Music For Games From Scratch,"Learn to compose music for any and every type of video game, from complete beginner to competent game music composer",https://udemy-images.udemy.com/course/125_H/953366_6d67.jpg,Karleen Heong,/gamemusiccourse/,$199.99,Production,Udemy,"6,10,15,22,23,28,32,33,43,54,59,60,61,62,64,74,77,79",76
