,course,description,image,instructor,link,price,subject,provider,jobs,subject_id
2001,SQL Tuning,Learn how to formulate and tune SQL statements for optimal performance,https://udemy-images.udemy.com/course/125_H/432074_fce1_2.jpg,Amarnath Reddy,/sql-tuning/,$99.99,Other,Udemy,"1,2,6,7,9,10,11,14,17,19,20,22,23,24,25,26,27,28,29,30,32,33,34,35,37,38,40,41,42,43,45,46,47,48,50,51,53,54,55,56,57,58,60,61,65,67,68,69,70,71,72,73,74,75,78,79,80",23
2002,Complete Linux course: Become a Linux professional,Learn all the Linux skills that will get you a career as a professional Linux System Administrator,https://udemy-images.udemy.com/course/125_H/137194_ece8_7.jpg,Muhammed Torkey,/linux-crash-course/,$194.99,Operating Systems,Udemy,42,30
2003,Python 3 For Beginner - Object-Oriented Programming,This is a Programming Course in Python. It will teach you coding from scratch  & Learn Python like a Professional!,https://udemy-images.udemy.com/course/125_H/1327920_1a89_2.jpg,Fayaz Khan,/python-3-beginner-oop/,$69.99,Programming Languages,Udemy,,24
2004,Agile Business Analysis,Developing the analysis maturity and confidence you need... to deliver products in an agile way...,https://udemy-images.udemy.com/course/125_H/1352388_2dbf.jpg,Don Hussey,/agile-business-analysis/,$89.99,Project Management,Udemy,"11,13,24,43,51,55,73",37
2005,"Dating, Relationship and Conversation Skills For Men","Dating, relationship and conversation skills for men who are looking to start dating more, high quality women.",https://udemy-images.udemy.com/course/125_H/391556_74b8_3.jpg,Erik Kiton,/dating-relationship-and-conversation-skills-for-manly-men/,$49.99,Self Esteem,Udemy,,80
2006,Android Development Working With Databases Using Mysql & PHP,In this complete course students will learn android development by working with databases using Mysql and PHP,https://udemy-images.udemy.com/course/125_H/796014_cf86_3.jpg,Joe Parys,/android-development-course/,$199.99,Mobile Apps,Udemy,"2,33,47,48,57,62,80,82",31
2007,Solo Ad Secrets: Build A Private 100K+ Email Marketing List,"Solo ads aren't hard, but mastery of solo ads requires sales funnels, landing pages, tracking & some marketing know-how.",https://udemy-images.udemy.com/course/125_H/1396808_a8f7_6.jpg,Zach Miller,/solo-ad-mastery-secrets-build-a-private-100k-email-marketing-list/,$99.99,Entrepreneurship,Udemy,,38
2008,Automation Testing using Selenium & Katalon Studio,"Learn to automate web application with Katalon Studio , which is as simple as using the excel file",https://udemy-images.udemy.com/course/125_H/1250764_bb5e_3.jpg,Rahul Singh Rathore,/automation-testing-using-selenium-katalon-studio/,$44.99,IT Certification,Udemy,,34
2009,SQL Server Administration Part1,SQL Education with a purpose,https://udemy-images.udemy.com/course/125_H/670712_65fb_3.jpg,Raphael Asghar,/sql-server-administration-part1/,$19.99,IT Certification,Udemy,,34
2010,Finish It! Motivation & Tactics For Game & App Development,"Tools And Techniques For Staying Motivated And Productive When Creating Video Games Or Apps, Or Finishing Online Courses",https://udemy-images.udemy.com/course/125_H/1230472_9e15_2.jpg,Rick Davidson,/finish-it/,$94.99,Productivity,Udemy,"55,71",63
2011,Inside Your Dog's Mind with Victoria Stilwell,"Understanding canine behavior and how dogs think, feel and learn to make dog training easier & more effective.",https://udemy-images.udemy.com/course/125_H/1177482_cafc.jpg,Victoria Stilwell,/insideyourdogsmind/,$199.99,Pet Care & Training,Udemy,,85
2012,REST API Automation testing from scratch-(REST Assured java),"Join the ""Most popular  REST API course"" - 4000+ students learning together with great collaboration""",https://udemy-images.udemy.com/course/125_H/694982_33b0.jpg,Rahul Shetty,/rest-api-automation-testing-rest-assured/,$199.99,Software Testing,Udemy,44,40
2013,Everyday Programming Skills for Beginners,Learn most popular programming languages with easy to understand examples,https://udemy-images.udemy.com/course/125_H/1375205_b81d_3.jpg,EDUmobile Academy,/everyday-programming-skills-for-beginners/,$194.99,Other,Udemy,"1,2,6,7,9,10,11,14,17,19,20,22,23,24,25,26,27,28,29,30,32,33,34,35,37,38,40,41,42,43,45,46,47,48,50,51,53,54,55,56,57,58,60,61,65,67,68,69,70,71,72,73,74,75,78,79,80",23
2014,Godot : Beginner to Advanced - Complete Course,Master the top Open Source game engine by recreating popular games and by exploring the fun features Godot has to offer.,https://udemy-images.udemy.com/course/125_H/1343252_d599_2.jpg,Dragan Neskovic,/godot-beginner-to-advanced-complete-course/,$199.99,Game Development,Udemy,,49
2015,Public Speaking and Communication Mastery,Vocal Awareness Course by its Founder! Voice Is Power. Unleash Yours Today. Inspire the World!,https://udemy-images.udemy.com/course/125_H/1451334_fdb4.jpg,Scott Paton,/vocal-awareness/,$194.99,Leadership,Udemy,"2,32,34,51,52,55,59,68,69,70,73",53
2016,CCA 175 - Spark and Hadoop Developer Certification - Scala,Cloudera Certified Associate Spark and Hadoop Developer using Scala as Programming Language,https://udemy-images.udemy.com/course/125_H/891848_fa96_2.jpg,Durga Viswanatha Raju Gadiraju,/cca-175-spark-and-hadoop-developer-certification-scala/,$119.99,IT Certification,Udemy,,34
2017,The Complete Angular 5 Essentials Course For Beginners,In our complete course students will learn all of the Angular 5 essentials from a complete beginner to advanced user!,https://udemy-images.udemy.com/course/125_H/1407832_b73d.jpg,Joe Parys,/angular5/,$199.99,Mobile Apps,Udemy,"2,33,47,48,57,62,80,82",31
2018,Financial Accounting - A Brief Introduction - in 60 Minutes,Learn the basics of financial accounting in one hour!,https://udemy-images.udemy.com/course/125_H/754028_c817_5.jpg,"Son Han, CFA, CPA",/accounting-in-less-then-one-hour/,$19.99,Finance,Udemy,"56,60,65",32
2019,Walk Yourself Wealthy - The Dog Walker Business Course,How to launch and grow a profitable dog walking business,https://udemy-images.udemy.com/course/125_H/1500726_379d.jpg,Dom Hodgson,/walk-yourself-wealthy-the-dog-walker-business-course/,$179.99,Pet Care & Training,Udemy,,85
2020,The Complete App Marketing Course,"Learn App Marketing, Secret ASO Strategies No One Tells You About to Skyrocket Your App Downloads & Revenue Instantly!",https://udemy-images.udemy.com/course/125_H/1185006_64da.jpg,London App Brewery LAB,/mobile-app-store-marketing-growth-hacking-course/,$199.99,Growth Hacking,Udemy,,82
2021,Learn SAS And Become A Data Ninja,Learn SAS. This is a SAS Programming Course For Beginners. Become a SAS Programmer!,https://udemy-images.udemy.com/course/125_H/943442_89d2_6.jpg,Ermin Dedic,/sascompletetutorial/,$194.99,Data & Analytics,Udemy,"2,3,5,6,9,11,12,13,16,24,26,27,28,29,30,31,32,33,37,43,44,45,48,53,55,56,59,61,62,63,65,70,74,75,76,78,80,81,84,85",27
2022,Create Your Own Hedge Fund: Trade Stocks Like A Fund Manager,Learn How To Trade Mean-Reversion Setups And Properly Leverage Your Account For Big Returns,https://udemy-images.udemy.com/course/125_H/447362_3599_6.jpg,Frank Bunn,/create-your-own-hedge-fund-double-your-money-every-year/,$174.99,Finance,Udemy,"56,60,65",32
2023,Anger Management Techniques That Actually Work,"How to Control Anger so You Can Feel Good, Have Better Relationships and Reduce Stress - Anger Management Techniques",https://udemy-images.udemy.com/course/125_H/688432_307e_4.jpg,Ken Wells,/howtocontrolanger/,$174.99,Stress Management,Udemy,,130
2024,Google Maps SEO: The 4 Pillars to Rank Your Website Page 1,Get insane traffic like viral marketing! SEO & online marketing that's easier than Google Organic rankings (by 120x)!,https://udemy-images.udemy.com/course/125_H/1467428_16da.jpg,Zach Miller,/google-maps-seo-the-4-pillars-to-rank-your-website-page-1/,$199.99,Search Engine Optimization,Udemy,,73
2025,Deeply Practical Project Management (Earn 9.5 PDUs),"How to implement project management using the standard PMI process in the simplest, most deeply practical way.",https://udemy-images.udemy.com/course/125_H/848496_b3be_12.jpg,"William Stewart PhD, PMP",/deeply-practical-project-management/,$199.99,Project Management,Udemy,"11,13,24,43,51,55,73",37
2026,Ultimate AngularJS to Angular Migration Guide,Learn how to migrate a legacy AngularJS application to a more current version of Angular.,https://udemy-images.udemy.com/course/125_H/1518950_10f5.jpg,Asim Hussain,/angularjs-migration/,$199.99,Web Development,Udemy,"16,18,21,27,41,47,54,56,62,65,68,69,70,82",22
2027,wordpress complete website with e-commerce : for beginners,Master wordpress from zero to hero with no coding or prior experience & build wordpress ecommerce online store website,https://udemy-images.udemy.com/course/125_H/1301572_5b8e.jpg,Khalil Ibrahim,/wordpress-complete-website-with-e-commerce-for-beginners/,$194.99,Web Development,Udemy,"16,18,21,27,41,47,54,56,62,65,68,69,70,82",22
2028,Learn Python: Python for Beginners,Python introduction for beginners. Learn complete Python from scratch!,https://udemy-images.udemy.com/course/125_H/426570_1b91_3.jpg,Abrar Hussain,/learn-python/,$29.99,Programming Languages,Udemy,,24
2029,Backbone Tutorial: Learn Backbonejs from Scratch,"A collection of hands-on, step-by-step, bite-sized Backbone tutorials covering fundamentals of Backbone.",https://udemy-images.udemy.com/course/125_H/306556_2af2_6.jpg,Mosh Hamedani,/backbonejs-tutorial/,$89.99,Web Development,Udemy,"16,18,21,27,41,47,54,56,62,65,68,69,70,82",22
2030,Adobe Illustrator CS6 Tutorial - Training Taught By Experts,Learn to create stunning art work Adobe Illustrator. A practical hands-on tutorial for Illustrator users of all levels,https://udemy-images.udemy.com/course/125_H/21477_2754_7.jpg,Infinite Skills,/learning-adobe-illustrator-cs6/,$49.99,Design Tools,Udemy,"34,36,58,67,80",67
2031,Develop your innovation - Certified Design Thinking Bootcamp,Make your own innovation using powerful tools.,https://udemy-images.udemy.com/course/125_H/1436714_48b1_3.jpg,Marcin Stasko,/develop-your-idea-design-thinking-bootcamp/,$94.99,Design Thinking,Udemy,"2,34,38,73,76",124
2032,Create Professional Looking Infographics With No Experience,Learn How To Design High Quality Professional Looking Infographics To Share Your Ideas Online And More!,https://udemy-images.udemy.com/course/125_H/1145736_939a_2.jpg,Masuk Sarker Batista,/create-professional-looking-infographics/,$169.99,Graphic Design,Udemy,"10,16,22,23,35,58,64",58
2033,Dominate The Hidden Job Market Of The Future,uncommon expert career advice from a top head-hunter who has recruited for Apple and Google,https://udemy-images.udemy.com/course/125_H/1104838_0abb_4.jpg,Ryan Lecour,/dominate-the-hidden-job-market-of-the-future/,$199.99,Career Development,Udemy,,64
2034,User Experience (UX): The Ultimate Guide to Usability and UX,Get a job in UX and build your user research and UX design skills with this hands-on user experience training course.,https://udemy-images.udemy.com/course/125_H/28258_8a7e_12.jpg,David Travis,/ultimate-guide-to-ux/,$194.99,User Experience,Udemy,"2,15,16,29,31,32,33,34,35,36,37,38,42,44,50,51,52,58,68,69,70,71,72,73,74,75,77,78",50
2035,Vector Logo Design in Affinity Designer,"Learn from a published, award winning, logo design professional!",https://udemy-images.udemy.com/course/125_H/1067516_1e3c_3.jpg,Daniel Evans,/logoaffinitydesigner/,$149.99,Graphic Design,Udemy,"10,16,22,23,35,58,64",58
2036,Scrivener |Full Course on How to Write a Book in Scrivener 2,Master all the Major Features of Your Scrivener Writing Software to Write eBooks and Paperback Books (Not for Scriv 3),https://udemy-images.udemy.com/course/125_H/575308_96fb_6.jpg,Karen Prince,/scrivener-everything-you-need-to-know-from-idea-to-launch/,$79.99,Media,Udemy,"3,8,12,17,22,23,24,26,27,28,29,35,38,44,45,50,58,60,62,64,70,82",72
2037,Google Cloud Course,A detailed guide to Google Cloud Platform,https://udemy-images.udemy.com/course/125_H/1492340_872e_2.jpg,Brilliant Academy Teachers,/google-cloud-course/,$199.99,Software Engineering,Udemy,"32,55",45
2038,How to Build Habit-Forming Products,Learn how to design experiences users love. Uncover the secrets of businesses able to keep users coming back.,https://udemy-images.udemy.com/course/125_H/126684_9100_11.jpg,Nir Eyal,/how-to-build-habit-forming-technology/,$49.99,User Experience,Udemy,"2,15,16,29,31,32,33,34,35,36,37,38,42,44,50,51,52,58,68,69,70,71,72,73,74,75,77,78",50
2039,The Ultimate Guide To Memory And Learning Skills,"Discover how our memory works and how to stimulate our brain, from newborn over teenager and adulthood to old age",https://udemy-images.udemy.com/course/125_H/945390_0bfd.jpg,Gregory Caremans - Brain Academy,/improve-memory/,$99.99,Memory & Study Skills,Udemy,,28
2040,Content is King: How to Write Killer Content for the Web,"Master the Art of Writing Online Content for eBooks, Websites, Blogs and Marketing. Develop Content Ideas & Copywriting",https://udemy-images.udemy.com/course/125_H/433790_b32c_4.jpg,Steve McDonald,/how-to-write-the-best-online-content/,$99.99,Content Marketing,Udemy,8,62
2041,Beginner affiliate marketing: start home business & succeed,"Best beginner affiliate marketing course: strategies & residual passive income home business programs. Amazon, Clickbank",https://udemy-images.udemy.com/course/125_H/187248_731a_6.jpg,Alex Genadinik,/make-money-with-affiliate-marketing-earn-passive-income/,$199.99,Affiliate Marketing,Udemy,,69
2042,The Ultimate Ethical Hacking Course 2017-Real world example,Professional Level Ethical Hacking & Penetration testing from Beginner to Advanced - From Real World Experience!,https://udemy-images.udemy.com/course/125_H/1042706_f107_5.jpg,Atul Tiwari,/real-world-hacking-penetration-testing/,$194.99,Network & Security,Udemy,"0,3,4,6,12,22,28,38,55",33
2043,CompTIA Network+ Cert (N10-006): Full Course & Practice Exam,CompTIA Network+ Bootcamp: Certification preparation course on the most popular networking certifications in the world!,https://udemy-images.udemy.com/course/125_H/1025702_1b5b_7.jpg,Jason Dion,/networkplus/,$199.99,IT Certification,Udemy,,34
2044,Become an iMovie Master - Create Amazing Movies Today,The quickest and easiest way to learn iMovie editing from beginner to advanced. (Practice Media Included),https://udemy-images.udemy.com/course/125_H/1244152_082c_3.jpg,Steve Burnich,/masteringimovie/,$199.99,Video Design,Udemy,,52
2045,CCA 175 - Spark and Hadoop Developer - Python (pyspark),Cloudera Certified Associate Spark and Hadoop Developer using Python as Programming Language,https://udemy-images.udemy.com/course/125_H/1398116_5583_2.jpg,Durga Viswanatha Raju Gadiraju,/cca-175-spark-and-hadoop-developer-python-pyspark/,$119.99,IT Certification,Udemy,,34
2046,Ubuntu Linux Server Basics,Learn Ubuntu Server administration in 3 days with this step-by-step course for beginners.,https://udemy-images.udemy.com/course/125_H/419458_f96e_9.jpg,Cody Ray Miller,/become-an-ubuntu-server-pro-in-just-3-days/,$94.99,Operating Systems,Udemy,42,30
2047,How to be Instagram famous in 2018,Step-by-Step Instagram Masterclass: Learn the secrets of Instagram Marketing,https://udemy-images.udemy.com/course/125_H/1376486_9532_2.jpg,Erick Bulatowicz,/instagram-marketing-strategy/,$194.99,Social Media Marketing,Udemy,"17,60",47
2048,Angular 5 Security Masterclass (with FREE E-Book),Practical Guide to Angular 5 Security  - Add Authentication / Authorization (from scratch) to an Angular 5 / Node App,https://udemy-images.udemy.com/course/125_H/1302770_6591_2.jpg,Angular University,/angular-security/,$149.99,Web Development,Udemy,"16,18,21,27,41,47,54,56,62,65,68,69,70,82",22
2049,"Facebook Live: Attract 100,000+ Page fans with Viral Streams",Learn how to create Viral Facebook Live Streams,https://udemy-images.udemy.com/course/125_H/994812_5bd8.jpg,Suppoman Â,/facebook-live/,$64.99,Video & Mobile Marketing,Udemy,"0,12,22,23,40,60",121
2050,Connect the Dots: Factor Analysis,"Factor extraction using PCA in Excel, R and Python",https://udemy-images.udemy.com/course/125_H/1121856_f4ae.jpg,Loony Corn,/connect-the-dots-factor-analysis/,$99.99,Data & Analytics,Udemy,"2,3,5,6,9,11,12,13,16,24,26,27,28,29,30,31,32,33,37,43,44,45,48,53,55,56,59,61,62,63,65,70,74,75,76,78,80,81,84,85",27
2051,Learn Angular 2 from Beginner to Advanced,Learn how to develop web applications using Angular 2,https://udemy-images.udemy.com/course/125_H/949282_2349.jpg,Ermin Kreponic,/learn-angular-2-from-beginner-to-advanced/,$194.99,Web Development,Udemy,"16,18,21,27,41,47,54,56,62,65,68,69,70,82",22
2052,Make an Assassins GO Board Game in Unity,Build a turn-based puzzle game with C# and Unity,https://udemy-images.udemy.com/course/125_H/1344820_665e_2.jpg,Wilmer Lin,/make-an-assassins-go-board-game-in-unity/,$94.99,Game Development,Udemy,,49
2053,JUnit and Mockito Crash Course,Learn how to use JUnit and Mockito and Unit Test in easy steps.,https://udemy-images.udemy.com/course/125_H/548058_a172_2.jpg,Bharath Thippireddy,/junitandmockitocrashcourse/,$19.99,Other,Udemy,"1,2,6,7,9,10,11,14,17,19,20,22,23,24,25,26,27,28,29,30,32,33,34,35,37,38,40,41,42,43,45,46,47,48,50,51,53,54,55,56,57,58,60,61,65,67,68,69,70,71,72,73,74,75,78,79,80",23
2054,CRUSH IT !!! Â Sales Strategies,Discover a step by step sales process you can drop into your business to re-connect with lost prospects. Close Sales Now,https://udemy-images.udemy.com/course/125_H/378912_08cb_7.jpg,Bob Marx,/crush-it-sales-strategies-to-follow-up-re-connect/,$199.99,Sales,Udemy,"0,5,6,7,12,22,23,24,26,29,30,34,36,45,61,67",78
2055,Snapchat Marketing: Attract New Customers & Grow Your Brand!,"Engage with a New Audience, Build Uniquely Strong Relationships, and Convert New Customers (With Almost No Competition)",https://udemy-images.udemy.com/course/125_H/664250_7e1a_5.jpg,Benjamin Wilson,/snapchat-for-business/,$19.99,Social Media Marketing,Udemy,"17,60",47
2056,The Complete Piano Course - Master The Piano,A full guide on learning how to use every single note on the piano. ,https://udemy-images.udemy.com/course/125_H/574974_2b9d_3.jpg,Iliya Ryakhovskiy,/the-complete-piano-course/,$94.99,Instruments,Udemy,,74
2057,RHCSA Exam Training by Infinite Skills,A detailed course that covers the requirements for passing the Red Hat Certified System Administrator ( Exam EX200 ),https://udemy-images.udemy.com/course/125_H/276788_06af_7.jpg,Infinite Skills,/red-hat-certified-system-administrator-exam-ex200-rhcsa/,$49.99,IT Certification,Udemy,,34
2058,Beauty of Dodge & Burn in Photoshop,Master Dodge & Burn and Learn Non Destructive Advanced Portrait Retouching Techniques in Photoshop,https://udemy-images.udemy.com/course/125_H/721706_f61d_3.jpg,Marcin Mikus,/dodgeburn/,$99.99,Design Tools,Udemy,"34,36,58,67,80",67
2059,Communication Skills for Beginners,Start Building Your Communication Skills Now,https://udemy-images.udemy.com/course/125_H/1551970_1d52_3.jpg,TJ Walker,/communication-skills-for-beginners-d/,$49.99,Communications,Udemy,"10,20,23,24,38,40,46,55,60,73,81",43
2060,MarketerÂs Guide To Creating Facebook Ads That Convert,Select high-converting ad images and craft ad copies that resonate with your target audience,https://udemy-images.udemy.com/course/125_H/640408_affc_3.jpg,Sandor Kiss,/facebook-marketing-how-to-create-converting-ads/,$199.99,Social Media Marketing,Udemy,"17,60",47
2061,"How to Get Your First 1,000 Facebook Fans: For Beginners",Learn how to build a big fan page community using one of the best and most effective traffic sources: Facebook.,https://udemy-images.udemy.com/course/125_H/575592_c8ca.jpg,Sandor Kiss,/facebook-marketing-like-campaign/,$199.99,Social Media Marketing,Udemy,"17,60",47
2062,Network and Vulnerability Scan for Hacking by Nmap & Nessus,"How hackers scan and find open ports , check for devices with vulnerabilities in a network by using Nmap & Nessus",https://udemy-images.udemy.com/course/125_H/1563128_c2a2_4.jpg,Muharrem AYDIN,/network-and-vulnerability-scanning-by-using-nmap-nessus/,$89.99,Network & Security,Udemy,"0,3,4,6,12,22,28,38,55",33
2063,Killer Programming Bundle: Learn Rails And Ruby Programming,Learn Both Ruby And Rails Fast!,https://udemy-images.udemy.com/course/125_H/1485662_17f9.jpg,John Elder,/ruby-code-and-ruby-on-rails-bundle/,$199.99,Web Development,Udemy,"16,18,21,27,41,47,54,56,62,65,68,69,70,82",22
2064,Rest Api's in Asp.Net Core and C#,"Build REST Api's With Asp.Net  , Entity Framework and C#",https://udemy-images.udemy.com/course/125_H/1563268_6bc6.jpg,Asfend Yar Hamid,/rest-apis-in-aspnet-core/,$99.99,Web Development,Udemy,"16,18,21,27,41,47,54,56,62,65,68,69,70,82",22
2065,"Mastering Airbnb | Learn from SF's top host, 100+ lectures","The comprehensive guide to meeting great people, getting paid to travel, and becoming a master of Airbnb",https://udemy-images.udemy.com/course/125_H/361978_1e2b_4.jpg,Evan Kimbrell,/mastering-airbnb-learn-from-sfs-top-host/,$164.99,Travel,Udemy,"2,22,28,29,74,76,84",131
2066,Wordpress 2015,"A step by step guide to making amazing and responsive Wordpress websites: a sleek business website, and an online resume",https://udemy-images.udemy.com/course/125_H/360538_d411_8.jpg,Andrew Eddy,/learn-wordpress-by-building-2-responsive-websites/,$19.99,Web Design,Udemy,"9,16,35,41,58,68,69,80,83",44
2067,The Ultimate QuickBooks Pro Training Bundle - 38 Hours,"Master QuickBooks Pro with this training bundle consisting of 6 courses, 38 hours, and over 350 videos.",https://udemy-images.udemy.com/course/125_H/128082_5026_6.jpg,Simon Sez IT,/the-ultimate-quickbooks-pro-training-bundle/,$199.99,Intuit,Udemy,"13,25,31,35,37,39,47,77",132
2068,Lean Management: Reduce waste and boost efficiency,"Learn how to use the principles of lean management to optimize production, eliminate waste, and maximize customer value",https://udemy-images.udemy.com/course/125_H/1426954_14f9_2.jpg,Evan Kimbrell,/lean-management-reduce-waste-and-boost-efficiency/,$99.99,Management,Udemy,"0,5,8,9,11,12,13,23,24,28,31,32,33,34,40,43,44,51,54,55,56,60,63,65,66,70,73,75,81",56
2069,"Reiki from ZERO to PRO: Complete Reiki I, II, III ART/Master","Reiki I, II, III ART/Master: Learn Original Japanese Reiki, Western Reiki & Chakra Healing Comprehensive Course",https://udemy-images.udemy.com/course/125_H/1298948_5b4f_18.jpg,Yoshi Raz,/reiki-one-a-certified-japanese-western-reiki-practitioner/,$199.99,Meditation,Udemy,,42
2070,How To Make A Great First Impression,"Using eye contact, your smile, a handshake and your words to make a GREAT first impression. ",https://udemy-images.udemy.com/course/125_H/572350_6b40_3.jpg,David Hyner,/how-to-make-a-great-first-impression/,$19.99,Communications,Udemy,"10,20,23,24,38,40,46,55,60,73,81",43
2071,Chris Bryant's CCNA Practice Exam Pack #1,Master The Details Of Vital CCNA Topics For CCNA And CCENT Exam Success With My Practice Exam Pack!,https://udemy-images.udemy.com/course/125_H/1302740_bd3d.jpg,Chris Bryant,/chris-bryant-ccna-practice-exam-1/,$19.99,IT Certification,Udemy,,34
2072,Top 10 Ways To Become A Great Communicator with Any Person,"Learn highly effective methods that will easily help you to connect, influence, understand and be understood by anyone",https://udemy-images.udemy.com/course/125_H/1473520_2474.jpg,Chen Froind,/top-10-ways-to-become-a-great-communicator-with-any-person/,$99.99,Influence,Udemy,"2,3,10,13,38,40,71,78",54
2073,"Complete Guide to Obtaining a Finance Job: Banking, HF & PE","BEST course to get finance interviews AND secure investment banking, hedge fund or private equity jobs",https://udemy-images.udemy.com/course/125_H/1421686_76a5_4.jpg,David Jaffee,/complete-guide-to-obtaining-a-finance-job-banking-hf-pe/,$199.99,Finance,Udemy,"56,60,65",32
2074,Complete Guide to Build IOT Things from Scratch to Market,"Build IOT products using Arduino, NodeMCU,ESP8266, IOT Platforms, Sensors, Displays, Keypads,Relays, PCB's,Casing & more",https://udemy-images.udemy.com/course/125_H/709804_c5cd_5.jpg,Junaid Ahmed,/complete-guide-to-build-iot-things-from-scratch-to-market/,$149.99,Development Tools,Udemy,66,41
2075,New CCNAx 200-125 Routing and Switching,Includes everything you will need to fully prepare for your new CCNA R/S certification,https://udemy-images.udemy.com/course/125_H/60346_042d_15.jpg,sikandar Shaik,/newccnax-200-120/,$99.99,IT Certification,Udemy,,34
2076,Adobe Illustrator Essentials for Character Design,Learn how to turn your paper drawings into beautiful art. Presentable products that you can pitch or sell,https://udemy-images.udemy.com/course/125_H/815086_b580.jpg,2D Animation 101 Courses,/adobe-illustrator-essentials-for-character-design/,$49.99,3D & Animation,Udemy,"6,17,24,31",61
2077,Java Programming Fundamentals,A step-by-step beginner's guide to programming in Java,https://udemy-images.udemy.com/course/125_H/1086390_3c6d_2.jpg,Zakaria Chowdhury,/java-programming-fundamentals/,$19.99,Programming Languages,Udemy,,24
2078,The Microsoft Excel 2016 Course: Advanced Excel Training,"Excel 2016: Advanced Excel Formatting, Excel Functions, Excel Pivot Tables, Excel Modeling in Practice: Hands-on!",https://udemy-images.udemy.com/course/125_H/994754_0338_3.jpg,365 Careers,/the-power-modeling-bootcamp-advanced-excel-in-10-days/,$149.99,Microsoft,Udemy,"11,23,30,63,73,79",36
2079,The complete SOLAR ENERGY course. Beginner to advanced level,The only course with everything you need to know on Solar Photovoltaic Energy,https://udemy-images.udemy.com/course/125_H/1461260_247a_3.jpg,Leandro Caruso,/the-complete-solar-energy-course-beginner-to-advanced-level/,$19.99,Math & Science,Udemy,"2,5,6,17,24,35,41",35
2080,Dive Into Adobe After Effects 2: Learn to Animate Graphics,A project-based course that guides you through animating a title card of your favorite brand in Adobe After Effects.,https://udemy-images.udemy.com/course/125_H/492186_835e_2.jpg,Phil Ebiner,/adobe-after-effects-course-tutorial-for-beginners-animating-keyframes/,$49.99,3D & Animation,Udemy,"6,17,24,31",61
